{
  "schemaVersion": "codex-blind-question-v1",
  "candidateId": "CQ-MATH-0009",
  "subject": "math",
  "topicCode": "M-FUNC-001",
  "topicTitle": "基本初等函数",
  "designedDifficulty": "basic",
  "questionType": "single_choice",
  "prompt": "对幂函数 f(x)=x^4，把 x=11 代入后，哪一条函数值等式成立？",
  "options": [
    {
      "id": "A",
      "text": "f(11)=14642"
    },
    {
      "id": "B",
      "text": "f(11)=14640"
    },
    {
      "id": "C",
      "text": "f(11)=-14641"
    },
    {
      "id": "D",
      "text": "f(11)=14641"
    }
  ],
  "knowledgeTags": [
    "基本初等函数",
    "幂函数",
    "函数值"
  ],
  "syllabusVersion": "2025",
  "questionPlan": {
    "schemaVersion": "subject-practice-question-plan-v1",
    "policyVersion": "subject-practice-question-plan-policy-v1",
    "subject": "math",
    "topicId": 69,
    "topicTitle": "基本初等函数",
    "productionCellId": 16,
    "targetDifficulty": "basic",
    "taskFamily": "elementary_function_direct_property",
    "planTemplate": "math_elementary_function_relation_v1",
    "representationType": "text",
    "renderConstraints": {
      "questionType": "single_choice",
      "requiresImage": false,
      "externalContextAllowed": false,
      "pureMathStemOnly": true,
      "forbidGenericFunctionListClassification": true,
      "forbidElementaryFunctionExternalContextWrapper": true,
      "requireMediumElementaryConcreteExpressionRelation": false,
      "requireBasicElementarySingleObjectSingleTarget": true,
      "singlePropertyTargetContractVersion": "math-basic-elementary-single-property-target-v1",
      "allowedSinglePropertyTargets": [
        "function_value",
        "domain",
        "range",
        "monotonicity"
      ],
      "requiredSinglePropertyTarget": "function_value",
      "requiredElementaryFunctionClass": "power",
      "forbidCrossPropertyDistractors": true,
      "forbidBasicElementaryEquationSolve": true,
      "forbidBasicElementaryOrderingChain": true,
      "forbidBasicElementaryParameterInference": true,
      "forbidBasicElementaryTargetProfileInflation": true,
      "maxFunctionPropertyStack": 1,
      "maxEnumeratedConditions": 1,
      "maxFunctionObjects": 1,
      "maxIndependentRelations": 1,
      "finalAnswerShape": "one_direct_elementary_function_property_or_value",
      "preferredPromptSkeletons": [
        "给出一个指数/对数/幂/根式函数表达式，只求定义域、单调性或一个函数值中的一项；题干与解析均不得提及未考查性质",
        "给出 log_a x、a^x、x^n 或一个简单根式的具体参数，只判断一个直接性质；不要用“无需判断其他性质”等否定措辞列出其他性质"
      ]
    },
    "budget": {
      "maxPlanRepairs": 2,
      "maxCandidateRepairs": 1
    },
    "scenarioContract": {
      "schemaVersion": "subject-practice-scenario-contract-v1",
      "policyVersion": "subject-practice-scenario-diversity-shadow-v2-multi-evidence-status",
      "stage": "shadow_only_thresholds_not_frozen",
      "scenarioMode": "abstract",
      "scenarioFamilyId": "math_abstract_function_object",
      "scenarioDomain": "pure_mathematics",
      "scenarioEntity": "function_object",
      "scenarioAction": "power:function_value",
      "informationForm": "symbolic_text",
      "scenarioFingerprint": "scenario-f9327659922a72e78c1b",
      "contextNecessity": "not_applicable",
      "requiredInformationFields": [],
      "solverRelevantFields": [],
      "surface": {
        "zhEntity": "",
        "enEntity": "",
        "zhSetting": "",
        "enSetting": "",
        "cueTokens": []
      },
      "plausibility": {
        "externalContextForbidden": true
      },
      "sourceIsolation": {
        "officialQuestionContentUsed": false,
        "reversibleSourceFieldsUsed": false,
        "selectionBasis": "controlled_catalog_and_sealed_ordinal_only"
      }
    },
    "evidenceSlots": [
      {
        "id": "e1",
        "type": "elementary_function_object",
        "role": "exponential_logarithmic_power_or_radical_expression",
        "independentGroup": "e1"
      },
      {
        "id": "e2",
        "type": "domain_order_or_graph_condition",
        "role": "domain_range_monotonicity_order_interval_or_graph_intersection",
        "independentGroup": "e1"
      }
    ],
    "hypotheses": [],
    "reasoningSteps": [
      {
        "id": "r1",
        "operation": "identify_elementary_function_domain_or_expression",
        "inputs": [
          "e1"
        ],
        "output": "function_frame"
      },
      {
        "id": "r2",
        "operation": "apply_domain_order_or_graph_condition",
        "inputs": [
          "function_frame",
          "e2"
        ],
        "output": "intermediate_relation"
      }
    ],
    "quantitativeRelations": [
      {
        "id": "q1",
        "type": "elementary_function_relation_round_trip",
        "expression": "domain, order, graph, inverse, or inequality relation checks the selected result",
        "variables": [
          "x",
          "log",
          "exp",
          "power"
        ],
        "roundTripCheck": true
      }
    ],
    "misconceptionTargets": [
      "ignoring domain restrictions",
      "comparing logs or powers by decimal guessing only",
      "medium elementary-function item as a generic function-list classification without a given expression relation",
      "hard elementary-function item without a second bound or parameter relation"
    ],
    "answerDerivation": [
      "use the elementary-function object and one visible relation to determine the answer"
    ],
    "uniquenessConditions": [
      "only one option satisfies all visible elementary-function relations"
    ]
  },
  "localizations": {
    "zh": {
      "prompt": "对幂函数 f(x)=x^4，把 x=11 代入后，哪一条函数值等式成立？",
      "options": [
        {
          "id": "A",
          "text": "f(11)=14642"
        },
        {
          "id": "B",
          "text": "f(11)=14640"
        },
        {
          "id": "C",
          "text": "f(11)=-14641"
        },
        {
          "id": "D",
          "text": "f(11)=14641"
        }
      ],
      "knowledgeTags": [
        "基本初等函数",
        "幂函数",
        "函数值"
      ]
    },
    "en": {
      "prompt": "For the rule f(x)=x^4, substitute x=11; which function-value equation is valid?",
      "options": [
        {
          "id": "A",
          "text": "f(11)=14642"
        },
        {
          "id": "B",
          "text": "f(11)=14640"
        },
        {
          "id": "C",
          "text": "f(11)=-14641"
        },
        {
          "id": "D",
          "text": "f(11)=14641"
        }
      ],
      "knowledgeTags": [
        "Elementary functions"
      ]
    }
  }
}
