{
  "schemaVersion": "codex-blind-question-v1",
  "candidateId": "CQ-CHEMISTRY-3014",
  "subject": "chemistry",
  "topicCode": "C-ELEC-FAR",
  "topicTitle": "电解原理",
  "designedDifficulty": "medium",
  "questionType": "single_choice",
  "prompt": "电解含 Ag⁺ 的溶液，阴极只发生 Ag⁺ 得电子析出 Ag。通过电量 9650 C，法拉第常数取 96500 C/mol，Ag 的摩尔质量为 108 g/mol。求阴极析出金属的质量。",
  "options": [
    {
      "id": "A",
      "text": "10.8 g"
    },
    {
      "id": "B",
      "text": "89.3519 g"
    },
    {
      "id": "C",
      "text": "11.8 g"
    },
    {
      "id": "D",
      "text": "12.8 g"
    }
  ],
  "knowledgeTags": [
    "电解原理",
    "综合推理"
  ],
  "syllabusVersion": "2025",
  "questionPlan": {
    "schemaVersion": "subject-practice-question-plan-v1",
    "policyVersion": "subject-practice-question-plan-policy-v1",
    "subject": "chemistry",
    "topicCode": "C-ELEC-FAR",
    "topicTitle": "电解原理",
    "targetDifficulty": "medium",
    "taskFamily": "electrolysis_faraday_deposition",
    "planTemplate": "pilot_v4_electrolysis_faraday_deposition_v1",
    "representationType": "text",
    "renderConstraints": {
      "questionType": "single_choice",
      "requiresImage": false,
      "externalContextAllowed": false,
      "language": "zh",
      "structureFingerprint": "77ecad830387f75109ce27d9",
      "scenarioDataMustAffectSolution": true
    },
    "scenarioContract": {
      "contextNecessity": "required_for_solution",
      "solverRelevantFields": [
        "M",
        "Q",
        "ion",
        "metal",
        "z"
      ],
      "sourceIsolation": {
        "officialQuestionContentUsed": false,
        "reversibleSourceFieldsUsed": false,
        "selectionBasis": "syllabus_metadata_and_local_parameters_only"
      }
    },
    "evidenceSlots": [
      {
        "id": "e1",
        "type": "visible_parameter",
        "role": "M",
        "independentGroup": "g1"
      },
      {
        "id": "e2",
        "type": "visible_parameter",
        "role": "Q",
        "independentGroup": "g2"
      },
      {
        "id": "e3",
        "type": "visible_parameter",
        "role": "ion",
        "independentGroup": "g3"
      },
      {
        "id": "e4",
        "type": "visible_parameter",
        "role": "metal",
        "independentGroup": "g4"
      },
      {
        "id": "e5",
        "type": "visible_parameter",
        "role": "z",
        "independentGroup": "g5"
      }
    ],
    "hypotheses": [],
    "reasoningSteps": [
      {
        "id": "r1",
        "operation": "charge",
        "inputs": [
          "e1",
          "e2",
          "e3",
          "e4",
          "e5"
        ],
        "output": "intermediate_1"
      },
      {
        "id": "r2",
        "operation": "electron amount",
        "inputs": [
          "r1"
        ],
        "output": "intermediate_2"
      },
      {
        "id": "r3",
        "operation": "metal amount",
        "inputs": [
          "r2"
        ],
        "output": "intermediate_3"
      },
      {
        "id": "r4",
        "operation": "mass",
        "inputs": [
          "r3"
        ],
        "output": "answer"
      }
    ],
    "quantitativeRelations": [
      {
        "id": "q1",
        "type": "deterministic_relation",
        "expression": "n(e)=Q/F",
        "roundTripCheck": true
      },
      {
        "id": "q2",
        "type": "deterministic_relation",
        "expression": "n(metal)=n(e)/z",
        "roundTripCheck": true
      },
      {
        "id": "q3",
        "type": "deterministic_relation",
        "expression": "m=nM",
        "roundTripCheck": true
      }
    ],
    "misconceptionTargets": [
      "忽略离子价态",
      "把电量直接换成金属物质的量"
    ],
    "answerDerivation": [
      "只使用题干可见数据，依照 reasoningSteps 顺序独立重算"
    ],
    "uniquenessConditions": [
      "四个选项经同一判定规则计算后恰有一个为真"
    ],
    "canonicalInputs": {
      "metal": "Ag",
      "ion": "Ag⁺",
      "Q": 9650,
      "z": 1,
      "M": 108
    },
    "verificationContract": {
      "version": "pilot-v4-batch-local-verifier-v1",
      "solverEvidenceBoundary": "prompt_options_and_question_plan",
      "independentOracleRequired": true,
      "optionTruthTableRequired": true,
      "explanationReplayRequired": true
    },
    "itemOrdinal": 2
  }
}
